[
  {
    "id": 1,
    "slug": "google-design-sprint-method",
    "Agile Method Name": "Google Design Sprint Method",
    "Data Type": [
      {
        "slug": "methodology",
        "label": "Methodology"
      }
    ],
    "Method Splash Image": [
      {
        "name": "google_design_sprint.png",
        "url": "https://baserow-backend-production20240528124524339000000001.s3.amazonaws.com/user_files/5rZG9ljfZulRIYl8illwn3asZub0A5YL_f6cc25602fad694f26c49539f8c9caffe67dabb07c161aa550002fe2b597ec84.png"
      }
    ],
    "When Is This Method Used?": "Reach for a Design Sprint when you have one big, risky question and need a real answer fast, before pouring months into building. It shines when a team is unsure which direction to take and wants to test an idea with actual users in days rather than quarters. It is also a quick way to get a group aligned, since everyone works through the problem together in the same room.",
    "Resource to Learn More": "https://www.gv.com/sprint/",
    "Other Agile Methods": [
      {
        "slug": "scrum-method",
        "label": "Scrum Method"
      },
      {
        "slug": "kanban-method",
        "label": "Kanban Method"
      },
      {
        "slug": "continuous-discovery-method",
        "label": "Continuous Discovery Method"
      },
      {
        "slug": "lean-ux-method",
        "label": "Lean UX Method"
      },
      {
        "slug": "scaled-agile-framework-method",
        "label": "Scaled Agile Framework Method"
      }
    ],
    "Job Roles that Use the Method": [
      {
        "slug": "ux-user-experience-design",
        "label": "UX (User Experience) Design"
      },
      {
        "slug": "ux-user-experience-research",
        "label": "UX (User Experience) Research"
      },
      {
        "slug": "product-ownership",
        "label": "Product Ownership"
      },
      {
        "slug": "product-management",
        "label": "Product Management"
      },
      {
        "slug": "ux-user-experience-writing",
        "label": "UX (User Experience) Writing"
      }
    ],
    "User Experience Research Tasks Involving the Methodology": [
      {
        "slug": "analyzing-research-findings",
        "label": "Analyzing Research Findings"
      },
      {
        "slug": "presenting-research-results",
        "label": "Presenting Research Results"
      },
      {
        "slug": "moderating-ux-research",
        "label": "Moderating UX Research"
      },
      {
        "slug": "secondary-research",
        "label": "Secondary Research"
      },
      {
        "slug": "card-sorting",
        "label": "Card Sorting "
      },
      {
        "slug": "interviewing",
        "label": "Interviewing"
      },
      {
        "slug": "surveys",
        "label": "Surveys"
      },
      {
        "slug": "diary-studies",
        "label": "Diary Studies"
      },
      {
        "slug": "contextual-inquiries",
        "label": "Contextual Inquiries"
      },
      {
        "slug": "observing-ethnography",
        "label": "Observing (Ethnography)"
      },
      {
        "slug": "usability-testing",
        "label": "Usability Testing"
      },
      {
        "slug": "prototype-concept-testing",
        "label": "Prototype Concept Testing "
      },
      {
        "slug": "a-b-prototype-test-creation",
        "label": "A/B Prototype Test Creation"
      },
      {
        "slug": "identifying-research-patterns",
        "label": "Identifying Research Patterns"
      },
      {
        "slug": "experiment-design",
        "label": "Experiment Design"
      },
      {
        "slug": "creating-research-plans",
        "label": "Creating Research Plans"
      }
    ],
    "User Experience Design Tasks Involving the Methodology": [
      {
        "slug": "wireframing",
        "label": "Wireframing"
      },
      {
        "slug": "design-component-creation",
        "label": "Design Component Creation"
      },
      {
        "slug": "brand-identity-formation",
        "label": "Brand Identity Formation"
      },
      {
        "slug": "icon-and-logo-creation",
        "label": "Icon and Logo Creation"
      },
      {
        "slug": "storyboarding",
        "label": "Storyboarding"
      },
      {
        "slug": "ui-kit-creation",
        "label": "UI Kit Creation"
      },
      {
        "slug": "developing-information-architecture",
        "label": "Developing Information Architecture"
      },
      {
        "slug": "prototype-creation",
        "label": "Prototype Creation"
      },
      {
        "slug": "ux-heuristics-analysis",
        "label": "UX Heuristics Analysis"
      },
      {
        "slug": "clickable-prototype-creation",
        "label": "Clickable Prototype Creation"
      },
      {
        "slug": "inventorying-content",
        "label": "Inventorying Content"
      },
      {
        "slug": "customer-experience-mapping",
        "label": "Customer Experience Mapping"
      },
      {
        "slug": "creating-presentations",
        "label": "Creating Presentations"
      },
      {
        "slug": "search-engine-optimization-seo-design",
        "label": "Search Engine Optimization (SEO) Design"
      }
    ],
    "Product Owner Tasks Involving the Methodology": [
      {
        "slug": "release-scope-definition",
        "label": "Release Scope Definition"
      },
      {
        "slug": "requirements-gathering",
        "label": "Requirements Gathering"
      },
      {
        "slug": "requirements-refinement",
        "label": "Requirements Refinement"
      },
      {
        "slug": "writing-requirements",
        "label": "Writing Requirements"
      },
      {
        "slug": "feature-vision-definition",
        "label": "Feature Vision Definition"
      },
      {
        "slug": "feature-scope-definition",
        "label": "Feature Scope Definition"
      },
      {
        "slug": "generating-problem-statements",
        "label": "Generating Problem Statements"
      },
      {
        "slug": "strategy-definition",
        "label": "Strategy Definition"
      },
      {
        "slug": "sprint-planning",
        "label": "Sprint Planning"
      },
      {
        "slug": "identifying-priorities",
        "label": "Identifying Priorities"
      },
      {
        "slug": "kickoff-intake",
        "label": "Kickoff / Intake"
      },
      {
        "slug": "product-positioning",
        "label": "Product Positioning"
      },
      {
        "slug": "tracking-epic-progress",
        "label": "Tracking Epic Progress"
      },
      {
        "slug": "product-roadmap-maintenance",
        "label": "Product Roadmap Maintenance"
      },
      {
        "slug": "market-research",
        "label": "Market Research"
      },
      {
        "slug": "tracking-sprint-progress",
        "label": "Tracking Sprint Progress"
      },
      {
        "slug": "user-acceptance-testing",
        "label": "User Acceptance Testing"
      },
      {
        "slug": "coaching-team-mates",
        "label": "Coaching Team Mates"
      },
      {
        "slug": "sprint-demo-facilitation",
        "label": "Sprint Demo Facilitation"
      },
      {
        "slug": "developing-go-to-market-strategy",
        "label": "Developing Go-To-Market Strategy"
      },
      {
        "slug": "customer-segmentation",
        "label": "Customer Segmentation"
      },
      {
        "slug": "price-testing",
        "label": "Price Testing"
      },
      {
        "slug": "defining-team-process",
        "label": "Defining Team Process"
      },
      {
        "slug": "creating-presentations",
        "label": "Creating Presentations"
      }
    ],
    "Agile Coach Tasks Involving the Methodology": [
      {
        "slug": "sprint-planning",
        "label": "Sprint Planning"
      },
      {
        "slug": "level-of-effort-estimation",
        "label": "Level of Effort Estimation"
      },
      {
        "slug": "velocity-calculation",
        "label": "Velocity Calculation"
      },
      {
        "slug": "defining-team-working-agreements",
        "label": "Defining Team Working Agreements"
      },
      {
        "slug": "team-role-and-responsibility-definition",
        "label": "Team Role and Responsibility Definition"
      },
      {
        "slug": "tracking-sprint-progress",
        "label": "Tracking Sprint Progress"
      },
      {
        "slug": "facilitating-agile-workshops",
        "label": "Facilitating Agile Workshops"
      },
      {
        "slug": "coaching-team-mates",
        "label": "Coaching Team Mates"
      },
      {
        "slug": "sprint-retrospective-facilitation",
        "label": "Sprint Retrospective Facilitation"
      },
      {
        "slug": "sprint-demo-facilitation",
        "label": "Sprint Demo Facilitation"
      },
      {
        "slug": "creating-presentations",
        "label": "Creating Presentations"
      }
    ],
    "All Tasks Involving the Methodology": [
      {
        "slug": "generating-problem-statements",
        "label": "Generating Problem Statements"
      },
      {
        "slug": "analyzing-research-findings",
        "label": "Analyzing Research Findings"
      },
      {
        "slug": "sprint-planning",
        "label": "Sprint Planning"
      },
      {
        "slug": "identifying-priorities",
        "label": "Identifying Priorities"
      },
      {
        "slug": "presenting-research-results",
        "label": "Presenting Research Results"
      },
      {
        "slug": "defining-team-working-agreements",
        "label": "Defining Team Working Agreements"
      },
      {
        "slug": "team-role-and-responsibility-definition",
        "label": "Team Role and Responsibility Definition"
      },
      {
        "slug": "moderating-ux-research",
        "label": "Moderating UX Research"
      },
      {
        "slug": "secondary-research",
        "label": "Secondary Research"
      },
      {
        "slug": "card-sorting",